{
  "schema_version": 1,
  "content_version": "0.2.0-core-complete",
  "budget": 12,
  "maximum_doctrines": 3,
  "selection_rules": {
	"home_world": { "label": "Home World", "minimum": 1, "maximum": 1, "counts_as_doctrine": false },
	"commander": { "label": "Commanding Officer", "minimum": 1, "maximum": 1, "counts_as_doctrine": false },
	"regiment_type": { "label": "Regiment Type", "minimum": 1, "maximum": 1, "counts_as_doctrine": true },
	"training_doctrine": { "label": "Training Doctrines", "minimum": 0, "maximum": 2, "counts_as_doctrine": true },
	"equipment_doctrine": { "label": "Equipment Doctrines", "minimum": 0, "maximum": 2, "counts_as_doctrine": true }
  },
  "sources": {
	"ow_core": { "title": "Only War Core Rulebook", "short": "OW Core" }
  },
  "rule_references": {
	"duplicate_grants": { "book": "ow_core", "page": 41 },
	"skill_ranks": { "book": "ow_core", "page": 114 },
	"regiment_budget": { "book": "ow_core", "page": 58 },
	"doctrine_limit": { "book": "ow_core", "page": 64 },
	"standard_kit": { "book": "ow_core", "page": 68 }
  },
  "skills": {
	"athletics": { "name": "Athletics", "maximum_rank": 4 },
	"awareness": { "name": "Awareness", "maximum_rank": 4 },
	"command": { "name": "Command", "maximum_rank": 4 },
	"common_lore_administratum": { "name": "Common Lore (Administratum)", "maximum_rank": 4 },
	"common_lore_ecclesiarchy": { "name": "Common Lore (Ecclesiarchy)", "maximum_rank": 4 },
	"common_lore_imperial_creed": { "name": "Common Lore (Imperial Creed)", "maximum_rank": 4 },
	"common_lore_imperial_guard": { "name": "Common Lore (Imperial Guard)", "maximum_rank": 4 },
	"common_lore_imperium": { "name": "Common Lore (Imperium)", "maximum_rank": 4 },
	"common_lore_war": { "name": "Common Lore (War)", "maximum_rank": 4 },
	"deceive": { "name": "Deceive", "maximum_rank": 4 },
	"forbidden_lore_daemonology": { "name": "Forbidden Lore (Daemonology)", "maximum_rank": 4 },
	"forbidden_lore_heresy": { "name": "Forbidden Lore (Heresy)", "maximum_rank": 4 },
	"forbidden_lore_mutants": { "name": "Forbidden Lore (Mutants)", "maximum_rank": 4 },
	"forbidden_lore_other_enemy": { "name": "Forbidden Lore (GM-approved enemy)", "maximum_rank": 4 },
	"forbidden_lore_xenos": { "name": "Forbidden Lore (Xenos)", "maximum_rank": 4 },
	"inquiry": { "name": "Inquiry", "maximum_rank": 4 },
	"intimidate": { "name": "Intimidate", "maximum_rank": 4 },
	"linguistics_high_gothic": { "name": "Linguistics (High Gothic)", "maximum_rank": 4 },
	"linguistics_low_gothic": { "name": "Linguistics (Low Gothic)", "maximum_rank": 4 },
	"navigate_surface": { "name": "Navigate (Surface)", "maximum_rank": 4 },
	"operate_aeronautica": { "name": "Operate (Aeronautica)", "maximum_rank": 4 },
	"operate_surface": { "name": "Operate (Surface)", "maximum_rank": 4 },
	"parry": { "name": "Parry", "maximum_rank": 4 },
	"survival": { "name": "Survival", "maximum_rank": 4 },
	"tech_use": { "name": "Tech-Use", "maximum_rank": 4 }
  },
  "talents": {
	"air_of_authority": { "name": "Air of Authority", "stackable": false },
	"catfall": { "name": "Catfall", "stackable": false },
	"combat_formation": { "name": "Combat Formation", "stackable": false },
	"combat_sense": { "name": "Combat Sense", "stackable": false },
	"deadeye_shot": { "name": "Deadeye Shot", "stackable": false },
	"die_hard": { "name": "Die Hard", "stackable": false },
	"double_team": { "name": "Double Team", "stackable": false },
	"foresight": { "name": "Foresight", "stackable": false },
	"hatred_chaos": { "name": "Hatred (Chaos forces)", "stackable": false },
	"hatred_daemons": { "name": "Hatred (Daemons)", "stackable": false },
	"hatred_dark_eldar": { "name": "Hatred (Dark Eldar)", "stackable": false },
	"hatred_eldar": { "name": "Hatred (Eldar)", "stackable": false },
	"hatred_mutants": { "name": "Hatred (Mutants)", "stackable": false },
	"hatred_orks": { "name": "Hatred (Orks)", "stackable": false },
	"hatred_other_enemy": { "name": "Hatred (GM-approved enemy)", "stackable": false },
	"hatred_tau": { "name": "Hatred (Tau)", "stackable": false },
	"hatred_tyranids": { "name": "Hatred (Tyranids)", "stackable": false },
	"heightened_senses_hearing": { "name": "Heightened Senses (Hearing)", "stackable": false },
	"light_sleeper": { "name": "Light Sleeper", "stackable": false },
	"lightning_reflexes": { "name": "Lightning Reflexes", "stackable": false },
	"nerves_of_steel": { "name": "Nerves of Steel", "stackable": false },
	"orthoproxy": { "name": "Orthoproxy", "stackable": false },
	"paranoia": { "name": "Paranoia", "stackable": false },
	"peer_nobility": { "name": "Peer (Nobility)", "stackable": false },
	"peer_underworld": { "name": "Peer (Underworld)", "stackable": false },
	"rapid_reaction": { "name": "Rapid Reaction", "stackable": false },
	"rapid_reload": { "name": "Rapid Reload", "stackable": false },
	"resistance_fear": { "name": "Resistance (Fear)", "stackable": false },
	"resistance_poisons": { "name": "Resistance (Poisons)", "stackable": false },
	"sprint": { "name": "Sprint", "stackable": false },
	"street_fighting": { "name": "Street Fighting", "stackable": false },
	"technical_knock": { "name": "Technical Knock", "stackable": false },
	"unremarkable": { "name": "Unremarkable", "stackable": false },
	"unshakeable_faith": { "name": "Unshakeable Faith", "stackable": false }
  },
  "base_effects": {
	"equipment": [
	  { "id": "uniform", "quantity": 1, "scope": "per_character" },
	  { "id": "poor_weather_gear", "quantity": 1, "scope": "per_character" },
	  { "id": "laspistol", "quantity": 1, "scope": "per_character", "slot": "main_weapon" },
	  { "id": "charge_pack", "quantity": 2, "scope": "per_character" },
	  { "id": "knife", "quantity": 1, "scope": "per_character", "slot": "melee_weapon" },
	  { "id": "flak_vest", "quantity": 1, "scope": "per_character", "slot": "armour" },
	  { "id": "rucksack", "quantity": 1, "scope": "per_character" },
	  { "id": "basic_tools", "quantity": 1, "scope": "per_character" },
	  { "id": "mess_kit", "quantity": 1, "scope": "per_character" },
	  { "id": "blanket", "quantity": 1, "scope": "per_character" },
	  { "id": "lamp_pack", "quantity": 1, "scope": "per_character" },
	  { "id": "grooming_kit", "quantity": 1, "scope": "per_character" },
	  { "id": "cognomen_tags", "quantity": 1, "scope": "per_character" },
	  { "id": "primer", "quantity": 1, "scope": "per_character" },
	  { "id": "rations", "quantity": 2, "scope": "per_character" }
	],
	"source": { "book": "ow_core", "page": 68 }
  },
  "options": [
	{
	  "id": "death_world", "category": "home_world", "name": "Death World", "cost": 3,
	  "summary": "Hardy survivors raised amid constant natural danger.",
	  "effects": {
		"skills": ["survival"], "wounds": 2,
		"special_rules": [
		  { "name": "Fluency", "summary": "Can speak Low Gothic but does not begin literate in it." },
		  { "name": "Wary of Outsiders", "summary": "-10 to Interaction tests in formal surroundings; non-death-worlders also suffer -10 to Interaction tests against them, subject to GM waiver." }
		]
	  },
	  "choices": [
		{ "id": "death_characteristic_1", "prompt": "Death World characteristic bonus 1", "scope": "per_character", "minimum": 1, "maximum": 1, "unique_group": "death_characteristics", "options": [
		  { "id": "perception", "label": "+3 Perception", "effects": { "characteristics": { "Perception": 3 } } },
		  { "id": "strength", "label": "+3 Strength", "effects": { "characteristics": { "Strength": 3 } } },
		  { "id": "toughness", "label": "+3 Toughness", "effects": { "characteristics": { "Toughness": 3 } } }
		] },
		{ "id": "death_characteristic_2", "prompt": "Death World characteristic bonus 2", "scope": "per_character", "minimum": 1, "maximum": 1, "unique_group": "death_characteristics", "options": [
		  { "id": "perception", "label": "+3 Perception", "effects": { "characteristics": { "Perception": 3 } } },
		  { "id": "strength", "label": "+3 Strength", "effects": { "characteristics": { "Strength": 3 } } },
		  { "id": "toughness", "label": "+3 Toughness", "effects": { "characteristics": { "Toughness": 3 } } }
		] },
		{ "id": "death_hardened_talent", "prompt": "Hardened talent", "scope": "per_character", "minimum": 1, "maximum": 1, "options": [
		  { "id": "light_sleeper", "label": "Light Sleeper", "effects": { "talents": ["light_sleeper"] } },
		  { "id": "lightning_reflexes", "label": "Lightning Reflexes", "effects": { "talents": ["lightning_reflexes"] } },
		  { "id": "resistance_poisons", "label": "Resistance (Poisons)", "effects": { "talents": ["resistance_poisons"] } }
		] }
	  ],
	  "source": { "book": "ow_core", "page": 59 }
	},
	{
	  "id": "fortress_world", "category": "home_world", "name": "Fortress World", "cost": 3,
	  "summary": "Disciplined soldiers raised for perpetual war and defence.",
	  "effects": {
		"skills": ["common_lore_war", "common_lore_imperium", "common_lore_imperial_guard", "linguistics_low_gothic"],
		"special_rules": [
		  { "name": "Hated Enemy", "summary": "The GM may require an Ordinary (+10) Willpower test to restrain attacks against the chosen enemy." },
		  { "name": "Bred for War", "summary": "Must pass a Challenging (+0) Willpower test to go against Imperial Guard rules and regulations." }
		]
	  },
	  "choices": [
		{ "id": "fortress_characteristic_1", "prompt": "Fortress World characteristic bonus 1", "scope": "per_character", "minimum": 1, "maximum": 1, "unique_group": "fortress_characteristics", "options": [
		  { "id": "ballistic_skill", "label": "+3 Ballistic Skill", "effects": { "characteristics": { "Ballistic Skill": 3 } } },
		  { "id": "willpower", "label": "+3 Willpower", "effects": { "characteristics": { "Willpower": 3 } } },
		  { "id": "toughness", "label": "+3 Toughness", "effects": { "characteristics": { "Toughness": 3 } } }
		] },
		{ "id": "fortress_characteristic_2", "prompt": "Fortress World characteristic bonus 2", "scope": "per_character", "minimum": 1, "maximum": 1, "unique_group": "fortress_characteristics", "options": [